"5EFA6AUX","preprint","2021","Poth, Clifton; Pfeiffer, Jonas; Rücklé, Andreas; Gurevych, Iryna","What to Pre-Train on? Efficient Intermediate Task Selection","","","","","http://arxiv.org/abs/2104.08247","Intermediate task fine-tuning has been shown to culminate in large transfer gains across many NLP tasks. With an abundance of candidate datasets as well as pre-trained language models, it has become infeasible to run the cross-product of all combinations to find the best transfer setting. In this work we first establish that similar sequential fine-tuning gains can be achieved in adapter settings, and subsequently consolidate previously proposed methods that efficiently identify beneficial tasks for intermediate transfer learning. We experiment with a diverse set of 42 intermediate and 11 target English classification, multiple choice, question answering, and sequence tagging tasks. Our results show that efficient embedding based methods that rely solely on the respective datasets outperform computational expensive few-shot fine-tuning approaches. Our best methods achieve an average Regret@3 of less than 1% across all target tasks, demonstrating that we are able to efficiently identify the best datasets for intermediate training.","2021-09-10","2023-03-09 14:00:22","2023-03-09 14:00:22","2023-03-09 14:00:22","","","","","","","What to Pre-Train on?","","","","","arXiv","","","","","","","arXiv.org","","arXiv:2104.08247 [cs]","","C:\Users\colde\Zotero\storage\CBT6C2ZC\Poth et al. - 2021 - What to Pre-Train on Efficient Intermediate Task .pdf; C:\Users\colde\Zotero\storage\22HPBWMY\2104.html","","","Computer Science - Computation and Language","","","","","","","","","","","","","","","","","","","arXiv:2104.08247","","","","","","","","","","","","","","","","","","","","","","","","","","",""
"IWX2C4NP","preprint","2019","Liu, Yinhan; Ott, Myle; Goyal, Naman; Du, Jingfei; Joshi, Mandar; Chen, Danqi; Levy, Omer; Lewis, Mike; Zettlemoyer, Luke; Stoyanov, Veselin","RoBERTa: A Robustly Optimized BERT Pretraining Approach","","","","10.48550/arXiv.1907.11692","http://arxiv.org/abs/1907.11692","Language model pretraining has led to significant performance gains but careful comparison between different approaches is challenging. Training is computationally expensive, often done on private datasets of different sizes, and, as we will show, hyperparameter choices have significant impact on the final results. We present a replication study of BERT pretraining (Devlin et al., 2019) that carefully measures the impact of many key hyperparameters and training data size. We find that BERT was significantly undertrained, and can match or exceed the performance of every model published after it. Our best model achieves state-of-the-art results on GLUE, RACE and SQuAD. These results highlight the importance of previously overlooked design choices, and raise questions about the source of recently reported improvements. We release our models and code.","2019-07-26","2023-03-09 14:00:27","2023-03-09 14:00:27","2023-03-09 14:00:27","","","","","","","RoBERTa","","","","","arXiv","","","","","","","arXiv.org","","arXiv:1907.11692 [cs]","","C:\Users\colde\Zotero\storage\Z3ALNUSI\Liu et al. - 2019 - RoBERTa A Robustly Optimized BERT Pretraining App.pdf; C:\Users\colde\Zotero\storage\X9GEUXTU\1907.html","","","Computer Science - Computation and Language","","","","","","","","","","","","","","","","","","","arXiv:1907.11692","","","","","","","","","","","","","","","","","","","","","","","","","","",""
"PVKYBU3E","conferencePaper","2010","Hong, Liangjie; Davison, Brian D.","Empirical study of topic modeling in Twitter","Proceedings of the First Workshop on Social Media Analytics","978-1-4503-0217-3","","10.1145/1964858.1964870","https://doi.org/10.1145/1964858.1964870","Social networks such as Facebook, LinkedIn, and Twitter have been a crucial source of information for a wide spectrum of users. In Twitter, popular information that is deemed important by the community propagates through the network. Studying the characteristics of content in the messages becomes important for a number of tasks, such as breaking news detection, personalized message recommendation, friends recommendation, sentiment analysis and others. While many researchers wish to use standard text mining tools to understand messages on Twitter, the restricted length of those messages prevents them from being employed to their full potential. We address the problem of using standard topic models in micro-blogging environments by studying how the models can be trained on the dataset. We propose several schemes to train a standard topic model and compare their quality and effectiveness through a set of carefully designed experiments from both qualitative and quantitative perspectives. We show that by training a topic model on aggregated messages we can obtain a higher quality of learned model which results in significantly better performance in two real-world classification problems. We also discuss how the state-of-the-art Author-Topic model fails to model hierarchical relationships between entities in Social Media.","2010-07-25","2023-03-09 14:00:47","2023-03-09 14:00:47","2023-03-09","80–88","","","","","","","SOMA '10","","","","Association for Computing Machinery","New York, NY, USA","","","","","","ACM Digital Library","","","","","","","social media; topic models; Twitter","","","","","","","","","","","","","","","","","","","","","","","","","","","","","","","","","","","","","","","","","","","","","",""
"3FTXAXKK","conferencePaper","2015","Resnik, Philip; Armstrong, William; Claudino, Leonardo; Nguyen, Thang; Nguyen, Viet-An; Boyd-Graber, Jordan","Beyond LDA: Exploring Supervised Topic Modeling for Depression-Related Language in Twitter","Proceedings of the 2nd Workshop on Computational Linguistics and Clinical Psychology: From Linguistic Signal to Clinical Reality","","","10.3115/v1/W15-1212","https://aclanthology.org/W15-1212","","2015-06-05","2023-03-09 14:00:50","2023-03-09 14:00:50","2023-03-09 14:00:50","99–107","","","","","","Beyond LDA","","","","","Association for Computational Linguistics","Denver, Colorado","","","","","","ACLWeb","","","","C:\Users\colde\Zotero\storage\MIAG5UBB\Resnik et al. - 2015 - Beyond LDA Exploring Supervised Topic Modeling fo.pdf","","","","","","","","","","","","","","","","","","","","","","","","","","","","","","","","","","CLPsych 2015","","","","","","","","","","","","","","",""
"NKV3EMKJ","webpage","","","Journal of Medical Internet Research - Characterizing Twitter Discussions About HPV Vaccines Using Topic Modeling and Community Detection","","","","","https://www.jmir.org/2016/8/e232/","","","2023-03-09 14:00:52","2023-03-09 14:00:52","2023-03-09 14:00:52","","","","","","","","","","","","","","","","","","","","","","","","","","","","","","","","","","","","","","","","","","","","","","","","","","","","","","","","","","","","","","","","","","","","","","","",""
"9J6CSMNM","journalArticle","2012","Hu, Yuheng; John, Ajita; Wang, Fei; Kambhampati, Subbarao","ET-LDA: Joint Topic Modeling for Aligning Events and their Twitter Feedback","Proceedings of the AAAI Conference on Artificial Intelligence","","2374-3468","10.1609/aaai.v26i1.8106","https://ojs.aaai.org/index.php/AAAI/article/view/8106","During broadcast events such as the Superbowl, the U.S. Presidential and Primary debates, etc., Twitter has become the de facto platform for crowds to share perspectives and commentaries about them. Given an event and an associated large-scale collection of tweets, there are two fundamental research problems that have been receiving increasing attention in recent years. One is to extract the topics covered by the event and the tweets; the other is to segment the event. So far these problems have been viewed separately and studied in isolation. In this work, we argue that these problems are in fact inter-dependent and should be addressed together. We develop a joint Bayesian model that performs topic modeling and event segmentation in one unified framework. We evaluate the proposed model both quantitatively and qualitatively on two large-scale tweet datasets associated with two events from different domains to show that it improves significantly over baseline models.","2012","2023-03-09 14:00:54","2023-03-09 14:00:54","2023-03-09 14:00:54","59-65","","1","26","","","ET-LDA","","","","","","","en","Copyright (c) 2021 Proceedings of the AAAI Conference on Artificial Intelligence","","","","ojs.aaai.org","","Number: 1","","C:\Users\colde\Zotero\storage\ECVDFDYG\Hu et al. - 2012 - ET-LDA Joint Topic Modeling for Aligning Events a.pdf","","","Bayesian Learning; ET-LDA; Event; Events; LDA; Machine Learning; Public Event; Public Events; Social Computing; Social Media; Social Netowrks; Topic Modeling; Tweets; Twitter","","","","","","","","","","","","","","","","","","","","","","","","","","","","","","","","","","","","","","","","","","","","","",""